{
  "$schema": "https://json-schema.org/draft/2020-12/schema",
  "$id": "https://plantree/schemas/work-order.json",
  "title": "WorkOrder",
  "description": "The costable unit of work — one job against an asset, moving through a configurable lifecycle (see workflow-profile.schema.json and work-management-lifecycle doc 05). A work order reaches the machine either converted from a WorkRequest (enters at 'requested') or generated by a MaintenanceSchedule (enters at 'planned', strategy already approved). When generated it carries a content SNAPSHOT of the pinned job-plan version so history stays truthful after the plan later changes. One JSON document = one work order, embedding its tasks, labour, parts, failure report and audited transition history.",
  "type": "object",
  "additionalProperties": false,
  "required": ["id", "type", "workOrderNumber", "workOrderTypeCode", "status", "statusHistory", "rev", "createdAt", "updatedAt"],
  "properties": {
    "id": { "type": "string", "description": "Opaque unique id, e.g. wo_2026_000123." },
    "type": { "const": "workOrder" },
    "workOrderNumber": { "type": "string", "description": "Human-facing sequential number, e.g. WO-2026-000123. Configurable numbering." },
    "assetId": { "type": ["string", "null"], "description": "Primary asset the work is against. May be null for administrative/operations types whose WorkOrderType.requiresAsset is false." },
    "workOrderTypeCode": {
      "type": "string",
      "pattern": "^[A-Z][A-Z0-9]{1,5}$",
      "description": "The kind of work, referencing a WorkOrderType by code (PM/RM/AD/OP seeded). Schedule-generated work inherits the JobPlan.workOrderTypeCode; requested work is set on triage."
    },
    "title": { "type": "string", "description": "Short summary of the work." },
    "description": { "type": ["string", "null"] },
    "priority": {
      "enum": ["low", "medium", "high", "urgent"],
      "description": "Confirmed (authoritative) priority. Combines with asset criticality to drive scheduling order and escalation; suggested on the request, confirmed here."
    },
    "status": { "type": "string", "description": "Current lifecycle state — a state key from the WorkflowProfile this order follows (default seed: requested, reviewed, approved, planned, scheduled, assigned, in_progress, awaiting_parts_access, completed, verified, closed, rejected)." },
    "dueDate": { "type": ["string", "null"], "format": "date-time", "description": "Derived from priority + SLA target. Overdue work is a first-class dashboard/notification trigger." },
    "scheduledStart": { "type": ["string", "null"], "format": "date-time" },
    "scheduledEnd": { "type": ["string", "null"], "format": "date-time" },
    "workflowProfileKey": { "type": ["string", "null"], "description": "Key of the WorkflowProfile this order follows; null = the org default profile." },
    "scheduleId": { "type": ["string", "null"], "description": "Provenance: the MaintenanceSchedule that generated this order (PM work). Null for requested/ad-hoc work." },
    "workRequestId": { "type": ["string", "null"], "description": "Provenance: the WorkRequest this order was converted from. Null for schedule-generated/ad-hoc work." },
    "jobPlanId": { "type": ["string", "null"], "description": "The pinned job plan (or class-family plan) this work follows. Null for ad-hoc work." },
    "jobPlanVersion": { "type": ["integer", "null"], "minimum": 1, "description": "The exact job-plan version pinned. With jobPlanId, identifies the content the snapshot was taken from." },
    "parentWorkOrderId": { "type": ["string", "null"], "description": "For multi-stage or follow-up work discovered during execution." },
    "dependsOn": { "type": "array", "items": { "type": "string" }, "description": "Predecessor work-order ids that must complete first (scheduling dependencies)." },
    "assignedTo": {
      "type": ["object", "null"],
      "additionalProperties": false,
      "required": ["kind", "id"],
      "description": "Who the work is dispatched to.",
      "properties": {
        "kind": { "enum": ["user", "crew", "contractor"] },
        "id": { "type": "string" },
        "name": { "type": ["string", "null"] }
      }
    },
    "estimatedLabourHours": { "type": ["number", "null"], "minimum": 0, "description": "Planned hours (from the plan or entered at planning)." },
    "actualLabourHours": { "type": ["number", "null"], "minimum": 0, "description": "Booked hours; derived as the sum of labour entries. Stored for convenience/reporting." },
    "onHold": {
      "type": ["object", "null"],
      "additionalProperties": false,
      "required": ["reason"],
      "description": "Present while in an on-hold state (awaiting_parts_access). Records why and pauses the SLA clock.",
      "properties": {
        "reason": { "enum": ["parts", "access", "permit", "weather", "other"] },
        "note": { "type": ["string", "null"] },
        "since": { "type": ["string", "null"], "format": "date-time" }
      }
    },
    "snapshot": { "$ref": "#/$defs/snapshot" },
    "tasks": { "type": "array", "items": { "$ref": "#/$defs/workOrderTask" } },
    "labour": { "type": "array", "items": { "$ref": "#/$defs/labourEntry" } },
    "parts": { "type": "array", "items": { "$ref": "#/$defs/partsUsage" } },
    "failure": { "oneOf": [ { "type": "null" }, { "$ref": "#/$defs/failureReport" } ], "description": "Failure/cause/remedy coding, captured at close for reactive (RM) work whose type requiresFailureReport." },
    "requiredPermits": { "type": "array", "items": { "type": "string" }, "description": "Permits that must be issued before work starts (assigned -> in_progress guard)." },
    "attachments": { "type": "array", "items": { "$ref": "#/$defs/attachment" } },
    "comments": { "type": "array", "items": { "$ref": "#/$defs/comment" } },
    "statusHistory": {
      "type": "array",
      "minItems": 1,
      "description": "The audited transition log — every state change, in order. The first entry records entry into the machine (from null). Closed/rejected entries are final.",
      "items": { "$ref": "#/$defs/statusEvent" }
    },
    "rev": { "type": "integer", "minimum": 0, "description": "Optimistic-concurrency revision; bumped on every save." },
    "createdAt": { "type": "string", "format": "date-time" },
    "createdBy": { "type": ["string", "null"] },
    "updatedAt": { "type": "string", "format": "date-time" },
    "updatedBy": { "type": ["string", "null"] }
  },
  "$defs": {
    "snapshot": {
      "type": ["object", "null"],
      "additionalProperties": false,
      "description": "A frozen copy of the applicable content at generation time: the pinned job-plan version, resolved parameter values (from asset/model) and safety controls. This — not a live reference — is what the technician executes and what history keeps, so the record stays truthful after the plan, parameters or strategy later change.",
      "properties": {
        "jobPlanCode": { "type": ["string", "null"] },
        "jobPlanVersion": { "type": ["integer", "null"], "minimum": 1 },
        "safetyInstructions": { "type": ["string", "null"] },
        "workOrderTypeCode": { "type": ["string", "null"] },
        "parameters": {
          "type": "array",
          "description": "Parameter values resolved from the asset/model at generation time (e.g. operating voltage, oil grade).",
          "items": {
            "type": "object",
            "additionalProperties": false,
            "required": ["key", "value"],
            "properties": {
              "key": { "type": "string" },
              "label": { "type": ["string", "null"] },
              "value": {},
              "unit": { "type": ["string", "null"] }
            }
          }
        },
        "takenAt": { "type": ["string", "null"], "format": "date-time" }
      }
    },
    "workOrderTask": {
      "type": "object",
      "additionalProperties": false,
      "required": ["id", "sequence", "instruction", "responseType"],
      "description": "An instantiated step / checklist item, copied from the pinned job-plan version (or ad-hoc). Carries both the definition and the captured result.",
      "properties": {
        "id": { "type": "string" },
        "jobPlanTaskId": { "type": ["string", "null"], "description": "Origin task id in the pinned job-plan version; null for ad-hoc steps added on the order." },
        "sequence": { "type": "integer", "minimum": 1 },
        "instruction": { "type": "string" },
        "responseType": { "enum": ["none", "passfail", "numeric", "text", "choice"] },
        "unit": { "type": ["string", "null"] },
        "acceptableRange": { "type": ["array", "null"], "items": { "type": "number" }, "minItems": 2, "maxItems": 2 },
        "choices": { "type": ["array", "null"], "items": { "type": "string" } },
        "response": { "description": "The captured result: boolean for passfail, number for numeric, string for text/choice, null if not yet done." },
        "outOfRange": { "type": ["boolean", "null"], "description": "For a numeric response, whether it fell outside acceptableRange. An out-of-range/failed response may spawn a follow-up WorkRequest." },
        "completed": { "type": "boolean", "default": false },
        "completedBy": { "type": ["string", "null"] },
        "completedAt": { "type": ["string", "null"], "format": "date-time" }
      }
    },
    "labourEntry": {
      "type": "object",
      "additionalProperties": false,
      "required": ["id", "hours"],
      "description": "Time booked against the order — the basis of labour cost and utilisation.",
      "properties": {
        "id": { "type": "string" },
        "userId": { "type": ["string", "null"] },
        "crewId": { "type": ["string", "null"] },
        "hours": { "type": "number", "minimum": 0 },
        "date": { "type": ["string", "null"], "format": "date" },
        "rate": { "type": ["number", "null"], "minimum": 0, "description": "Hourly rate for cost roll-up." },
        "trade": { "type": ["string", "null"] },
        "startAt": { "type": ["string", "null"], "format": "date-time" },
        "endAt": { "type": ["string", "null"], "format": "date-time" }
      }
    },
    "partsUsage": {
      "type": "object",
      "additionalProperties": false,
      "required": ["id", "description"],
      "description": "Parts reserved then consumed against the order. Reserve-then-consume: reservedQty is set at 'scheduled', consumedQty deducts stock at or before 'completed' — never earlier.",
      "properties": {
        "id": { "type": "string" },
        "partRef": { "type": ["string", "null"], "description": "Future reference to a Part; free text for now." },
        "description": { "type": "string" },
        "reservedQty": { "type": ["number", "null"], "minimum": 0 },
        "consumedQty": { "type": ["number", "null"], "minimum": 0 },
        "unit": { "type": ["string", "null"] },
        "unitCost": { "type": ["number", "null"], "minimum": 0 }
      }
    },
    "failureReport": {
      "type": "object",
      "additionalProperties": false,
      "required": ["failureCode"],
      "description": "Failure/cause/remedy coding — the raw material for reliability analysis (MTBF/MTTR).",
      "properties": {
        "failureCode": { "type": "string" },
        "causeCode": { "type": ["string", "null"] },
        "remedyCode": { "type": ["string", "null"] },
        "downtimeStart": { "type": ["string", "null"], "format": "date-time" },
        "downtimeEnd": { "type": ["string", "null"], "format": "date-time" },
        "observations": { "type": ["string", "null"] }
      }
    },
    "attachment": {
      "type": "object",
      "additionalProperties": false,
      "required": ["id", "name"],
      "properties": {
        "id": { "type": "string" },
        "name": { "type": "string" },
        "url": { "type": ["string", "null"] },
        "addedBy": { "type": ["string", "null"] },
        "addedAt": { "type": ["string", "null"], "format": "date-time" }
      }
    },
    "comment": {
      "type": "object",
      "additionalProperties": false,
      "required": ["id", "body"],
      "properties": {
        "id": { "type": "string" },
        "author": { "type": ["string", "null"] },
        "at": { "type": ["string", "null"], "format": "date-time" },
        "body": { "type": "string", "description": "Supports @mentions, which raise notifications." }
      }
    },
    "statusEvent": {
      "type": "object",
      "additionalProperties": false,
      "required": ["to", "at"],
      "description": "One entry in the audited transition log.",
      "properties": {
        "from": { "type": ["string", "null"], "description": "Prior state key; null for the entry event." },
        "to": { "type": "string", "description": "New state key." },
        "at": { "type": "string", "format": "date-time" },
        "by": { "type": ["string", "null"], "description": "Actor who made the transition." },
        "reason": { "type": ["string", "null"], "description": "Required for rejections and holds; optional otherwise." }
      }
    }
  }
}
